{
  "client_did": "did:dfos:8zk83zez862n6ahnvt3h3e4kc4n2dke",
  "identity_chain": [
    "eyJhbGciOiJFZERTQSIsInR5cCI6ImRpZDpkZm9zOmlkZW50aXR5LW9wIiwia2lkIjoia2V5X3Y3NjNoNnJmNnJrZW5laDNkejl6NDlmOWhla25oZnQiLCJjaWQiOiJiYWZ5cmVpYXl3eTdzYnZjdmp5ZzM3Y21tcXdrbW15cGtpcmc0d3BmdGljcnpqcjNpN3dwcjJkZm0zaSJ9.eyJhc3NlcnRLZXlzIjpbXSwiYXV0aEtleXMiOlt7ImlkIjoia2V5X25yYzRyMjN2azcyYWY4NDRyaGZhYTY2NG56ZGV6cjIiLCJ0eXBlIjoiTXVsdGlrZXkiLCJwdWJsaWNLZXlNdWx0aWJhc2UiOiJ6Nk1rb25MTTl4aWpETDROaVJReDhzUTc1bkdzOTZ4SnpYUVU3cmR5RHJtdWRpcHcifV0sImNvbnRyb2xsZXJLZXlzIjpbeyJpZCI6ImtleV92NzYzaDZyZjZya2VuZWgzZHo5ejQ5ZjloZWtuaGZ0IiwidHlwZSI6Ik11bHRpa2V5IiwicHVibGljS2V5TXVsdGliYXNlIjoiejZNa21nWm9pY24zdWFrUHRKbnNldFpiYUIyUFhmdHhRaE1yTWJqRWVyalkxNXRtIn1dLCJjcmVhdGVkQXQiOiIyMDI2LTA4LTIzVDIzOjQ4OjEzLjI1NVoiLCJ0eXBlIjoiY3JlYXRlIiwidmVyc2lvbiI6MX0.x-pzc7LgKpmi2ShY1wuIAkPpCLQEyxHY403Jbg3h8PT7Z6OEtw6ki6E3KNpVgHrGsQjeX8bbeJHYPsBdVpZjDQ",
    "eyJhbGciOiJFZERTQSIsInR5cCI6ImRpZDpkZm9zOmlkZW50aXR5LW9wIiwia2lkIjoiZGlkOmRmb3M6OHprODN6ZXo4NjJuNmFobnZ0M2gzZTRrYzRuMmRrZSNrZXlfdjc2M2g2cmY2cmtlbmVoM2R6OXo0OWY5aGVrbmhmdCIsImNpZCI6ImJhZnlyZWllaW5jZWV2ZHg1c2VqbWJ0dzR6MnRzNmdqYWl1bGtrNmVyaHppcG5qbnM0YTdhNXNmb3c0In0.eyJhc3NlcnRLZXlzIjpbXSwiYXV0aEtleXMiOlt7ImlkIjoia2V5X25yYzRyMjN2azcyYWY4NDRyaGZhYTY2NG56ZGV6cjIiLCJ0eXBlIjoiTXVsdGlrZXkiLCJwdWJsaWNLZXlNdWx0aWJhc2UiOiJ6Nk1rb25MTTl4aWpETDROaVJReDhzUTc1bkdzOTZ4SnpYUVU3cmR5RHJtdWRpcHcifSx7ImlkIjoia2V5XzZ6cmt6OXZoMzlmZWE2aDllbjY5OGhmZDRma25jZDYiLCJ0eXBlIjoiTXVsdGlrZXkiLCJwdWJsaWNLZXlNdWx0aWJhc2UiOiJ6Nk1rcjZyTGRod2pIMU5XWVJLejVXUXJacTJkZExiaGNiOGdqQ2Rtdkc3aUdBN2QifV0sImNvbnRyb2xsZXJLZXlzIjpbeyJpZCI6ImtleV92NzYzaDZyZjZya2VuZWgzZHo5ejQ5ZjloZWtuaGZ0IiwidHlwZSI6Ik11bHRpa2V5IiwicHVibGljS2V5TXVsdGliYXNlIjoiejZNa21nWm9pY24zdWFrUHRKbnNldFpiYUIyUFhmdHhRaE1yTWJqRWVyalkxNXRtIn1dLCJjcmVhdGVkQXQiOiIyMDI2LTA4LTI1VDE0OjU0OjQzLjc5M1oiLCJwcmV2aW91c09wZXJhdGlvbkNJRCI6ImJhZnlyZWlheXd5N3NidmN2anlnMzdjbW1xd2ttbXlwa2lyZzR3cGZ0aWNyempyM2k3d3ByMmRmbTNpIiwidHlwZSI6InVwZGF0ZSIsInZlcnNpb24iOjF9.fkgo6Oc9TO_5l_gmDISyG5mEsd9T_zhd5Oav2QXNtpjJGkpUaS149A6TN2u4ZyKnMRXFTQ9mHwf17GBK5wBxDw"
  ],
  "name": "SIWD Demo",
  "redirect_uris": ["https://dfos-siwd-demo.vercel.app/"]
}
