{
  "client_did": "did:dfos:2dcddatr3h3zr76hrrthe692zc7t4re",
  "identity_chain": [
    "eyJhbGciOiJFZERTQSIsInR5cCI6ImRpZDpkZm9zOmlkZW50aXR5LW9wIiwia2lkIjoia2V5XzlhNHIyaDNmYThuYzlhaGtkNmt0enJkNmZ2ZTRuZjIiLCJjaWQiOiJiYWZ5cmVpZnUzbmxmMnp5bXZnenZsdTQ0emRxenlmd2djcTc3cjNraDJrNnhlYXJqb2p4ZXdzeWczaSJ9.eyJ2ZXJzaW9uIjoxLCJ0eXBlIjoiY3JlYXRlIiwiYXV0aEtleXMiOlt7ImlkIjoia2V5XzlhNHIyaDNmYThuYzlhaGtkNmt0enJkNmZ2ZTRuZjIiLCJ0eXBlIjoiTXVsdGlrZXkiLCJwdWJsaWNLZXlNdWx0aWJhc2UiOiJ6Nk1rb245Z1dBNEhnZkJVMUc3QWt1Z05VdEQ4RGU5TnJpNmhyclV6QjZ1Q1ZESFQifV0sImFzc2VydEtleXMiOlt7ImlkIjoia2V5XzlhNHIyaDNmYThuYzlhaGtkNmt0enJkNmZ2ZTRuZjIiLCJ0eXBlIjoiTXVsdGlrZXkiLCJwdWJsaWNLZXlNdWx0aWJhc2UiOiJ6Nk1rb245Z1dBNEhnZkJVMUc3QWt1Z05VdEQ4RGU5TnJpNmhyclV6QjZ1Q1ZESFQifV0sImNvbnRyb2xsZXJLZXlzIjpbeyJpZCI6ImtleV85YTRyMmgzZmE4bmM5YWhrZDZrdHpyZDZmdmU0bmYyIiwidHlwZSI6Ik11bHRpa2V5IiwicHVibGljS2V5TXVsdGliYXNlIjoiejZNa29uOWdXQTRIZ2ZCVTFHN0FrdWdOVXREOERlOU5yaTZocnJVekI2dUNWREhUIn1dLCJjcmVhdGVkQXQiOiIyMDI2LTAzLTA3VDAwOjAwOjAwLjAwMFoifQ._tFLwtAWMpvMex9WSvl-wwn3OLNTHIvm-XyUCyHyb9veIdxmZ46OmzFA7baPA36dV12Yf2zPPh7NGxpfmdUrBg",
    "eyJhbGciOiJFZERTQSIsInR5cCI6ImRpZDpkZm9zOmlkZW50aXR5LW9wIiwia2lkIjoiZGlkOmRmb3M6MmRjZGRhdHIzaDN6cjc2aHJydGhlNjkyemM3dDRyZSNrZXlfOWE0cjJoM2ZhOG5jOWFoa2Q2a3R6cmQ2ZnZlNG5mMiIsImNpZCI6ImJhZnlyZWlmZ2w1ZzVkbWx2NmxhZ3ZtdzZmcHE3bmc0cm9yaHU1NjVhNDRocG1va2xiMm00b2dmdjJ5In0.eyJ2ZXJzaW9uIjoxLCJ0eXBlIjoidXBkYXRlIiwicHJldmlvdXNPcGVyYXRpb25DSUQiOiJiYWZ5cmVpZnUzbmxmMnp5bXZnenZsdTQ0emRxenlmd2djcTc3cjNraDJrNnhlYXJqb2p4ZXdzeWczaSIsImF1dGhLZXlzIjpbeyJpZCI6ImtleV85YTRyMmgzZmE4bmM5YWhrZDZrdHpyZDZmdmU0bmYyIiwidHlwZSI6Ik11bHRpa2V5IiwicHVibGljS2V5TXVsdGliYXNlIjoiejZNa29uOWdXQTRIZ2ZCVTFHN0FrdWdOVXREOERlOU5yaTZocnJVekI2dUNWREhUIn0seyJpZCI6ImtleV90djMzaGQ2cm5rN3JycnJrYWNjcjZoZjQ5NHRmMjdjIiwidHlwZSI6Ik11bHRpa2V5IiwicHVibGljS2V5TXVsdGliYXNlIjoiejZNa3NDdTFWcnUyYllKWWF3REZ3VEZCWjRnTVhpYVVOanNGY2pmTjR2RGU2VnZHIn1dLCJhc3NlcnRLZXlzIjpbeyJpZCI6ImtleV85YTRyMmgzZmE4bmM5YWhrZDZrdHpyZDZmdmU0bmYyIiwidHlwZSI6Ik11bHRpa2V5IiwicHVibGljS2V5TXVsdGliYXNlIjoiejZNa29uOWdXQTRIZ2ZCVTFHN0FrdWdOVXREOERlOU5yaTZocnJVekI2dUNWREhUIn1dLCJjb250cm9sbGVyS2V5cyI6W3siaWQiOiJrZXlfOWE0cjJoM2ZhOG5jOWFoa2Q2a3R6cmQ2ZnZlNG5mMiIsInR5cGUiOiJNdWx0aWtleSIsInB1YmxpY0tleU11bHRpYmFzZSI6Ino2TWtvbjlnV0E0SGdmQlUxRzdBa3VnTlV0RDhEZTlOcmk2aHJyVXpCNnVDVkRIVCJ9XSwiY3JlYXRlZEF0IjoiMjAyNi0wMy0wN1QwMDowMTowMC4wMDBaIiwia2V5UHJvb2ZzIjpbImV5SmhiR2NpT2lKRlpFUlRRU0lzSW5SNWNDSTZJbVJwWkRwa1ptOXpPbXRsZVMxaFpHUWlmUS5leUp1YjI1alpTSTZJbVY0Y0d4dmNtVnlMWGRsYkd4cmJtOTNiaTFtYVhoMGRYSmxMVzV2Ym1ObElpd2lZWFZrYVdWdVkyVWlPaUprYVdRNlpHWnZjem95WkdOa1pHRjBjak5vTTNweU56Wm9jbkowYUdVMk9USjZZemQwTkhKbElpd2laR2xrSWpvaVpHbGtPbVJtYjNNNk1tUmpaR1JoZEhJemFETjZjamMyYUhKeWRHaGxOamt5ZW1NM2REUnlaU0lzSW5KdmJHVlRaWFFpT2lKaGRYUm9JaXdpY0hKbGRrTkpSQ0k2SW1KaFpubHlaV2xtZFROdWJHWXllbmx0ZG1kNmRteDFORFI2WkhGNmVXWjNaMk54TnpkeU0ydG9NbXMyZUdWaGNtcHZhbmhsZDNONVp6TnBJaXdpY0hWaWJHbGpTMlY1VFhWc2RHbGlZWE5sSWpvaWVqWk5hM05EZFRGV2NuVXlZbGxLV1dGM1JFWjNWRVpDV2pSblRWaHBZVlZPYW5OR1kycG1UalIyUkdVMlZuWkhJaXdpZEdsdFpYTjBZVzF3SWpvaU1qQXlOaTB3TXkwd04xUXdNRG93TURvek1DNHdNREJhSW4wLmVhaTlXX2NScjRXY2ptbklrZGxOdy1Nb2xVZDBPdGdzS19oM05pWE0xWVN1bmtzamlpcGVkOHZVMUo1eFphTG9JakZpeS1sVlFkaUoxYi1RYWo4TkJ3Il19.6Rj2Kjiad7kn5FOxa_lzUbhmmRfBjCUxsBpEVo_lUU0N3bQrGwOFzSPnuCZhZcnF89x-bS4cWXsmYNsoroT4Cw"
  ],
  "name": "Explorer Fixture App",
  "redirect_uris": [
    "https://explorer-fixture.example/cb"
  ]
}
